{
  "unitId": "EN-A1-COUNTABLE-UNCOUNTABLE-01",
  "title": "Countable & Uncountable Nouns",
  "level": "A1",
  "language": "en",
  "leadIn": {
    "title": "Lead-In & Context: Countable & Uncountable Nouns",
    "content": "Contextual introduction and guided observation for Countable & Uncountable Nouns."
  },
  "meaningCheck": [
    {
      "question": "Function check: What is the primary purpose of using Countable & Uncountable Nouns?",
      "targetStructure": "countable-uncountable",
      "options": [
        "To express clear, level-appropriate meaning in structured context",
        "To translate sentences word-for-word from another language",
        "It is an obsolete form never used by native speakers"
      ],
      "correctOptionIndex": 0,
      "explanation": "Correct · This structure provides explicit grammatical function and clarity."
    },
    {
      "question": "Form check: Does correct usage of Countable & Uncountable Nouns require matching subject, verb, and modifier agreements?",
      "targetStructure": "countable-uncountable",
      "options": [
        "No, agreement rules are optional in English",
        "Yes, matching grammatical forms ensures natural, accurate communication",
        "Agreement only matters in formal academic writing"
      ],
      "correctOptionIndex": 1,
      "explanation": "Correct · Accurate form and agreement choices prevent misunderstandings."
    }
  ],
  "form": {
    "title": "Form & Structure: Countable & Uncountable Nouns",
    "content": "Grammatical formulation, usage rules, and structural tables for Countable & Uncountable Nouns."
  },
  "pronunciation": {
    "title": "Pronunciation Notes: Countable & Uncountable Nouns",
    "content": "Spoken stress, weak forms, intonation, and articulation patterns for Countable & Uncountable Nouns."
  },
  "controlledPractice": [
    {
      "question": "Which is uncountable?",
      "targetStructure": "countable-uncountable",
      "options": [
        "apple",
        "chair",
        "water"
      ],
      "correctOptionIndex": 2,
      "explanation": "Water has no plural form and can't be counted directly · it's uncountable."
    },
    {
      "question": "'She has three ___.' (information)",
      "targetStructure": "countable-uncountable",
      "options": [
        "informations",
        "piece of information",
        "pieces of information"
      ],
      "correctOptionIndex": 2,
      "explanation": "Use a container word to count uncountable nouns: pieces of information."
    },
    {
      "question": "'How ___ apples do you have?'",
      "targetStructure": "countable-uncountable",
      "options": [
        "much",
        "many",
        "a lot"
      ],
      "correctOptionIndex": 1,
      "explanation": "Many is used with countable plural nouns."
    }
  ],
  "freerPractice": {
    "title": "Freer Practice: Countable & Uncountable Nouns",
    "content": "Guided communicative exchanges applying Countable & Uncountable Nouns in everyday conversation.",
    "links": [
      "COSYgames/scene_match"
    ]
  },
  "production": {
    "title": "Communicative Production: Countable & Uncountable Nouns",
    "content": "Independent oral production and real-world task execution using Countable & Uncountable Nouns.",
    "links": [
      "COSYevents/speaking-club"
    ]
  }
}