{
  "unitId": "EN-A1-NUMBERS-DATES-01",
  "title": "Numbers, Days & Months",
  "level": "A1",
  "language": "en",
  "leadIn": {
    "title": "Lead-In & Context: Numbers, Days & Months",
    "content": "Contextual introduction and guided observation for Numbers, Days & Months."
  },
  "meaningCheck": [
    {
      "question": "Function check: What is the primary purpose of using Numbers, Days & Months?",
      "targetStructure": "numbers-dates",
      "options": [
        "To express clear, level-appropriate meaning in structured context",
        "To translate sentences word-for-word from another language",
        "It is an obsolete form never used by native speakers"
      ],
      "correctOptionIndex": 0,
      "explanation": "Correct · This structure provides explicit grammatical function and clarity."
    },
    {
      "question": "Form check: Does correct usage of Numbers, Days & Months require matching subject, verb, and modifier agreements?",
      "targetStructure": "numbers-dates",
      "options": [
        "No, agreement rules are optional in English",
        "Yes, matching grammatical forms ensures natural, accurate communication",
        "Agreement only matters in formal academic writing"
      ],
      "correctOptionIndex": 1,
      "explanation": "Correct · Accurate form and agreement choices prevent misunderstandings."
    }
  ],
  "form": {
    "title": "Form & Structure: Numbers, Days & Months",
    "content": "Grammatical formulation, usage rules, and structural tables for Numbers, Days & Months."
  },
  "pronunciation": {
    "title": "Pronunciation Notes: Numbers, Days & Months",
    "content": "Spoken stress, weak forms, intonation, and articulation patterns for Numbers, Days & Months."
  },
  "controlledPractice": [
    {
      "question": "Ordinal form of 3?",
      "targetStructure": "numbers-dates",
      "options": [
        "threeth",
        "third",
        "3ths"
      ],
      "correctOptionIndex": 1,
      "explanation": "3 → third is an irregular ordinal, like first and second."
    },
    {
      "question": "Which day comes right after Wednesday?",
      "targetStructure": "numbers-dates",
      "options": [
        "Tuesday",
        "Thursday",
        "Friday"
      ],
      "correctOptionIndex": 1,
      "explanation": "The order is Monday, Tuesday, Wednesday, Thursday…"
    },
    {
      "question": "Which month comes right before August?",
      "targetStructure": "numbers-dates",
      "options": [
        "June",
        "July",
        "September"
      ],
      "correctOptionIndex": 1,
      "explanation": "July comes immediately before August."
    }
  ],
  "freerPractice": {
    "title": "Freer Practice: Numbers, Days & Months",
    "content": "Guided communicative exchanges applying Numbers, Days & Months in everyday conversation.",
    "links": [
      "COSYgames/scene_match"
    ]
  },
  "production": {
    "title": "Communicative Production: Numbers, Days & Months",
    "content": "Independent oral production and real-world task execution using Numbers, Days & Months.",
    "links": [
      "COSYevents/speaking-club"
    ]
  }
}