{
  "unitId": "EN-A1-ID-LIKE-01",
  "title": "I'd Like / Would You Like…?",
  "level": "A1",
  "language": "en",
  "leadIn": {
    "title": "Lead-In & Context: I'd Like / Would You Like…?",
    "content": "Contextual introduction and guided observation for I'd Like / Would You Like…?."
  },
  "meaningCheck": [
    {
      "question": "Function check: What is the primary purpose of using I'd Like / Would You Like…??",
      "targetStructure": "id-like",
      "options": [
        "To express clear, level-appropriate meaning in structured context",
        "To translate sentences word-for-word from another language",
        "It is an obsolete form never used by native speakers"
      ],
      "correctOptionIndex": 0,
      "explanation": "Correct · This structure provides explicit grammatical function and clarity."
    },
    {
      "question": "Form check: Does correct usage of I'd Like / Would You Like…? require matching subject, verb, and modifier agreements?",
      "targetStructure": "id-like",
      "options": [
        "No, agreement rules are optional in English",
        "Yes, matching grammatical forms ensures natural, accurate communication",
        "Agreement only matters in formal academic writing"
      ],
      "correctOptionIndex": 1,
      "explanation": "Correct · Accurate form and agreement choices prevent misunderstandings."
    }
  ],
  "form": {
    "title": "Form & Structure: I'd Like / Would You Like…?",
    "content": "Grammatical formulation, usage rules, and structural tables for I'd Like / Would You Like…?."
  },
  "pronunciation": {
    "title": "Pronunciation Notes: I'd Like / Would You Like…?",
    "content": "Spoken stress, weak forms, intonation, and articulation patterns for I'd Like / Would You Like…?."
  },
  "controlledPractice": [
    {
      "question": "Polite way to order: '___ a coffee, please.'",
      "targetStructure": "id-like",
      "options": [
        "I like",
        "I'd like",
        "I want"
      ],
      "correctOptionIndex": 1,
      "explanation": "I'd like is the polite way to make a request."
    },
    {
      "question": "Making an offer: '___ you like some tea?'",
      "targetStructure": "id-like",
      "options": [
        "Do",
        "Would",
        "Are"
      ],
      "correctOptionIndex": 1,
      "explanation": "Would you like…? is used to make a polite offer."
    },
    {
      "question": "'I'd' is short for:",
      "targetStructure": "id-like",
      "options": [
        "I did",
        "I would",
        "I had only"
      ],
      "correctOptionIndex": 1,
      "explanation": "I'd = I would in this structure."
    }
  ],
  "freerPractice": {
    "title": "Freer Practice: I'd Like / Would You Like…?",
    "content": "Guided communicative exchanges applying I'd Like / Would You Like…? in everyday conversation.",
    "links": [
      "COSYgames/scene_match"
    ]
  },
  "production": {
    "title": "Communicative Production: I'd Like / Would You Like…?",
    "content": "Independent oral production and real-world task execution using I'd Like / Would You Like…?.",
    "links": [
      "COSYevents/speaking-club"
    ]
  }
}