{
  "unitId": "EN-A1-DEMONSTRATIVES-01",
  "title": "This, That, These, Those",
  "level": "A1",
  "language": "en",
  "leadIn": {
    "title": "Lead-In & Context: This, That, These, Those",
    "content": "Contextual introduction and guided observation for This, That, These, Those."
  },
  "meaningCheck": [
    {
      "question": "Function check: What is the primary purpose of using This, That, These, Those?",
      "targetStructure": "demonstratives",
      "options": [
        "To express clear, level-appropriate meaning in structured context",
        "To translate sentences word-for-word from another language",
        "It is an obsolete form never used by native speakers"
      ],
      "correctOptionIndex": 0,
      "explanation": "Correct · This structure provides explicit grammatical function and clarity."
    },
    {
      "question": "Form check: Does correct usage of This, That, These, Those require matching subject, verb, and modifier agreements?",
      "targetStructure": "demonstratives",
      "options": [
        "No, agreement rules are optional in English",
        "Yes, matching grammatical forms ensures natural, accurate communication",
        "Agreement only matters in formal academic writing"
      ],
      "correctOptionIndex": 1,
      "explanation": "Correct · Accurate form and agreement choices prevent misunderstandings."
    }
  ],
  "form": {
    "title": "Form & Structure: This, That, These, Those",
    "content": "Grammatical formulation, usage rules, and structural tables for This, That, These, Those."
  },
  "pronunciation": {
    "title": "Pronunciation Notes: This, That, These, Those",
    "content": "Spoken stress, weak forms, intonation, and articulation patterns for This, That, These, Those."
  },
  "controlledPractice": [
    {
      "question": "Something is far away and there is only one of it. Which word?",
      "targetStructure": "demonstratives",
      "options": [
        "This",
        "That",
        "These"
      ],
      "correctOptionIndex": 1,
      "explanation": "Far + singular → that."
    },
    {
      "question": "'I like ___ books.' (near, plural)",
      "targetStructure": "demonstratives",
      "options": [
        "this",
        "that",
        "these"
      ],
      "correctOptionIndex": 2,
      "explanation": "Near + plural → these."
    },
    {
      "question": "Fix: 'Those is my brother.'",
      "targetStructure": "demonstratives",
      "options": [
        "Those are my brother.",
        "That is my brother.",
        "This are my brother."
      ],
      "correctOptionIndex": 1,
      "explanation": "One brother, far away → that is."
    }
  ],
  "freerPractice": {
    "title": "Freer Practice: This, That, These, Those",
    "content": "Guided communicative exchanges applying This, That, These, Those in everyday conversation.",
    "links": [
      "COSYgames/scene_match"
    ]
  },
  "production": {
    "title": "Communicative Production: This, That, These, Those",
    "content": "Independent oral production and real-world task execution using This, That, These, Those.",
    "links": [
      "COSYevents/speaking-club"
    ]
  }
}