{
  "unitId": "EN-A1-PART-10-TENSE-SYSTEM-01",
  "title": "Tense System",
  "level": "A1",
  "language": "en",
  "leadIn": {
    "title": "Lead-In & Context: Tense System",
    "content": "Contextual introduction and guided observation for Tense System."
  },
  "meaningCheck": [
    {
      "question": "Function check: What is the primary purpose of using Tense System?",
      "targetStructure": "part-10-tense-system",
      "options": [
        "To express clear, level-appropriate meaning in structured context",
        "To translate sentences word-for-word from another language",
        "It is an obsolete form never used by native speakers"
      ],
      "correctOptionIndex": 0,
      "explanation": "Correct · This structure provides explicit grammatical function and clarity."
    },
    {
      "question": "Form check: Does correct usage of Tense System require matching subject, verb, and modifier agreements?",
      "targetStructure": "part-10-tense-system",
      "options": [
        "No, agreement rules are optional in English",
        "Yes, matching grammatical forms ensures natural, accurate communication",
        "Agreement only matters in formal academic writing"
      ],
      "correctOptionIndex": 1,
      "explanation": "Correct · Accurate form and agreement choices prevent misunderstandings."
    }
  ],
  "form": {
    "title": "Form & Structure: Tense System",
    "content": "Grammatical formulation, usage rules, and structural tables for Tense System."
  },
  "pronunciation": {
    "title": "Pronunciation Notes: Tense System",
    "content": "Spoken stress, weak forms, intonation, and articulation patterns for Tense System."
  },
  "controlledPractice": [],
  "freerPractice": {
    "title": "Freer Practice: Tense System",
    "content": "Guided communicative exchanges applying Tense System in everyday conversation.",
    "links": [
      "COSYgames/scene_match"
    ]
  },
  "production": {
    "title": "Communicative Production: Tense System",
    "content": "Independent oral production and real-world task execution using Tense System.",
    "links": [
      "COSYevents/speaking-club"
    ]
  }
}