{
  "unitId": "EN-A1-PAST-SIMPLE-BE-01",
  "title": "Past Simple of 'To Be'",
  "level": "A1",
  "language": "en",
  "leadIn": {
    "title": "Lead-In & Context: Past Simple of 'To Be'",
    "content": "Contextual introduction and guided observation for Past Simple of 'To Be'."
  },
  "meaningCheck": [
    {
      "question": "\"I visited Paris in 2019.\" — Is the trip to Paris completely finished?",
      "targetStructure": "past-simple-be",
      "options": [
        "Yes, the action finished at a specific completed time in the past",
        "No, the speaker is still in Paris right now",
        "The trip will happen next year"
      ],
      "correctOptionIndex": 0,
      "explanation": "Correct · Past simple refers to finished actions at a specific time in the past."
    },
    {
      "question": "\"She lived in Rome for two years.\" — Does she live in Rome now?",
      "targetStructure": "past-simple-be",
      "options": [
        "Yes, she still lives in Rome",
        "No, she does not live in Rome anymore",
        "She is moving to Rome tomorrow"
      ],
      "correctOptionIndex": 1,
      "explanation": "Correct · Past simple indicates the period of living in Rome is completely over."
    }
  ],
  "form": {
    "title": "Form & Structure: Past Simple of 'To Be'",
    "content": "Grammatical formulation, usage rules, and structural tables for Past Simple of 'To Be'."
  },
  "pronunciation": {
    "title": "Pronunciation Notes: Past Simple of 'To Be'",
    "content": "Spoken stress, weak forms, intonation, and articulation patterns for Past Simple of 'To Be'."
  },
  "controlledPractice": [
    {
      "question": "'They ___ late.'",
      "targetStructure": "past-simple-be",
      "options": [
        "was",
        "were",
        "is"
      ],
      "correctOptionIndex": 1,
      "explanation": "They is plural → were."
    },
    {
      "question": "'I ___ at home yesterday.'",
      "targetStructure": "past-simple-be",
      "options": [
        "was",
        "were",
        "am"
      ],
      "correctOptionIndex": 0,
      "explanation": "I is singular → was."
    },
    {
      "question": "Question: '___ you late?'",
      "targetStructure": "past-simple-be",
      "options": [
        "Was",
        "Were",
        "Did"
      ],
      "correctOptionIndex": 1,
      "explanation": "You always pairs with 'were', even asking about one person."
    }
  ],
  "freerPractice": {
    "title": "Freer Practice: Past Simple of 'To Be'",
    "content": "Guided communicative exchanges applying Past Simple of 'To Be' in everyday conversation.",
    "links": [
      "COSYgames/scene_match"
    ]
  },
  "production": {
    "title": "Communicative Production: Past Simple of 'To Be'",
    "content": "Independent oral production and real-world task execution using Past Simple of 'To Be'.",
    "links": [
      "COSYevents/speaking-club"
    ]
  }
}