{
  "unitId": "EN-A1-MUCH-MANY-01",
  "title": "Much / Many / A few / A little",
  "level": "A1",
  "language": "en",
  "leadIn": {
    "title": "Lead-In & Context: Much / Many / A few / A little",
    "content": "Contextual introduction and guided observation for Much / Many / A few / A little."
  },
  "meaningCheck": [
    {
      "question": "Function check: What is the primary purpose of using Much / Many / A few / A little?",
      "targetStructure": "much-many",
      "options": [
        "To express clear, level-appropriate meaning in structured context",
        "To translate sentences word-for-word from another language",
        "It is an obsolete form never used by native speakers"
      ],
      "correctOptionIndex": 0,
      "explanation": "Correct · This structure provides explicit grammatical function and clarity."
    },
    {
      "question": "Form check: Does correct usage of Much / Many / A few / A little require matching subject, verb, and modifier agreements?",
      "targetStructure": "much-many",
      "options": [
        "No, agreement rules are optional in English",
        "Yes, matching grammatical forms ensures natural, accurate communication",
        "Agreement only matters in formal academic writing"
      ],
      "correctOptionIndex": 1,
      "explanation": "Correct · Accurate form and agreement choices prevent misunderstandings."
    }
  ],
  "form": {
    "title": "Form & Structure: Much / Many / A few / A little",
    "content": "Grammatical formulation, usage rules, and structural tables for Much / Many / A few / A little."
  },
  "pronunciation": {
    "title": "Pronunciation Notes: Much / Many / A few / A little",
    "content": "Spoken stress, weak forms, intonation, and articulation patterns for Much / Many / A few / A little."
  },
  "controlledPractice": [
    {
      "question": "'How ___ friends do you have?'",
      "targetStructure": "much-many",
      "options": [
        "much",
        "many",
        "little"
      ],
      "correctOptionIndex": 1,
      "explanation": "Friends is countable plural → many."
    },
    {
      "question": "'There is ___ milk left.' (a small uncountable amount)",
      "targetStructure": "much-many",
      "options": [
        "a few",
        "a little",
        "many"
      ],
      "correctOptionIndex": 1,
      "explanation": "A little is used for small uncountable quantities."
    },
    {
      "question": "Most natural in an affirmative sentence:",
      "targetStructure": "much-many",
      "options": [
        "I have much water.",
        "I have a lot of water.",
        "I have many water."
      ],
      "correctOptionIndex": 1,
      "explanation": "'A lot of' is the natural choice in affirmative sentences; 'much' suits questions/negatives."
    }
  ],
  "freerPractice": {
    "title": "Freer Practice: Much / Many / A few / A little",
    "content": "Guided communicative exchanges applying Much / Many / A few / A little in everyday conversation.",
    "links": [
      "COSYgames/scene_match"
    ]
  },
  "production": {
    "title": "Communicative Production: Much / Many / A few / A little",
    "content": "Independent oral production and real-world task execution using Much / Many / A few / A little.",
    "links": [
      "COSYevents/speaking-club"
    ]
  }
}