{
  "unitId": "EN-A1-ADVERBS-MANNER-01",
  "title": "Adverbs of Manner",
  "level": "A1",
  "language": "en",
  "leadIn": {
    "title": "Lead-In & Context: Adverbs of Manner",
    "content": "Contextual introduction and guided observation for Adverbs of Manner."
  },
  "meaningCheck": [
    {
      "question": "Function check: What is the primary purpose of using Adverbs of Manner?",
      "targetStructure": "adverbs-manner",
      "options": [
        "To express clear, level-appropriate meaning in structured context",
        "To translate sentences word-for-word from another language",
        "It is an obsolete form never used by native speakers"
      ],
      "correctOptionIndex": 0,
      "explanation": "Correct · This structure provides explicit grammatical function and clarity."
    },
    {
      "question": "Form check: Does correct usage of Adverbs of Manner require matching subject, verb, and modifier agreements?",
      "targetStructure": "adverbs-manner",
      "options": [
        "No, agreement rules are optional in English",
        "Yes, matching grammatical forms ensures natural, accurate communication",
        "Agreement only matters in formal academic writing"
      ],
      "correctOptionIndex": 1,
      "explanation": "Correct · Accurate form and agreement choices prevent misunderstandings."
    }
  ],
  "form": {
    "title": "Form & Structure: Adverbs of Manner",
    "content": "Grammatical formulation, usage rules, and structural tables for Adverbs of Manner."
  },
  "pronunciation": {
    "title": "Pronunciation Notes: Adverbs of Manner",
    "content": "Spoken stress, weak forms, intonation, and articulation patterns for Adverbs of Manner."
  },
  "controlledPractice": [
    {
      "question": "Adverb of 'careful'?",
      "targetStructure": "adverbs-manner",
      "options": [
        "carefully",
        "carefuly",
        "carefulley"
      ],
      "correctOptionIndex": 0,
      "explanation": "Most adjectives simply add -ly: careful → carefully."
    },
    {
      "question": "Adverb of 'good'?",
      "targetStructure": "adverbs-manner",
      "options": [
        "goodly",
        "well",
        "gooder"
      ],
      "correctOptionIndex": 1,
      "explanation": "Good → well is an irregular adverb."
    },
    {
      "question": "Fix: 'She sings beautiful.'",
      "targetStructure": "adverbs-manner",
      "options": [
        "She sings beautifully.",
        "She sings beautifuly.",
        "She sing beautiful."
      ],
      "correctOptionIndex": 0,
      "explanation": "An adverb (not adjective) is needed to describe how she sings."
    }
  ],
  "freerPractice": {
    "title": "Freer Practice: Adverbs of Manner",
    "content": "Guided communicative exchanges applying Adverbs of Manner in everyday conversation.",
    "links": [
      "COSYgames/scene_match"
    ]
  },
  "production": {
    "title": "Communicative Production: Adverbs of Manner",
    "content": "Independent oral production and real-world task execution using Adverbs of Manner.",
    "links": [
      "COSYevents/speaking-club"
    ]
  }
}