{
  "unitId": "EN-A1-IRREGULAR-VERBS-01",
  "title": "Irregular Verbs",
  "level": "A1",
  "language": "en",
  "leadIn": {
    "title": "Lead-In & Context: Irregular Verbs",
    "content": "Contextual introduction and guided observation for Irregular Verbs."
  },
  "meaningCheck": [
    {
      "question": "Function check: What is the primary purpose of using Irregular Verbs?",
      "targetStructure": "irregular-verbs",
      "options": [
        "To express clear, level-appropriate meaning in structured context",
        "To translate sentences word-for-word from another language",
        "It is an obsolete form never used by native speakers"
      ],
      "correctOptionIndex": 0,
      "explanation": "Correct · This structure provides explicit grammatical function and clarity."
    },
    {
      "question": "Form check: Does correct usage of Irregular Verbs require matching subject, verb, and modifier agreements?",
      "targetStructure": "irregular-verbs",
      "options": [
        "No, agreement rules are optional in English",
        "Yes, matching grammatical forms ensures natural, accurate communication",
        "Agreement only matters in formal academic writing"
      ],
      "correctOptionIndex": 1,
      "explanation": "Correct · Accurate form and agreement choices prevent misunderstandings."
    }
  ],
  "form": {
    "title": "Form & Structure: Irregular Verbs",
    "content": "Grammatical formulation, usage rules, and structural tables for Irregular Verbs."
  },
  "pronunciation": {
    "title": "Pronunciation Notes: Irregular Verbs",
    "content": "Spoken stress, weak forms, intonation, and articulation patterns for Irregular Verbs."
  },
  "controlledPractice": [
    {
      "question": "Past of 'give'?",
      "targetStructure": "irregular-verbs",
      "options": [
        "gived",
        "gave",
        "given"
      ],
      "correctOptionIndex": 1,
      "explanation": "Give → gave (vowel-change group)."
    },
    {
      "question": "Past of 'buy'?",
      "targetStructure": "irregular-verbs",
      "options": [
        "buyed",
        "bought",
        "boughted"
      ],
      "correctOptionIndex": 1,
      "explanation": "Buy → bought (add -t/-d group)."
    },
    {
      "question": "Past of 'be'?",
      "targetStructure": "irregular-verbs",
      "options": [
        "beed",
        "was/were",
        "been"
      ],
      "correctOptionIndex": 1,
      "explanation": "Be → was/were, the most irregular verb of all."
    },
    {
      "question": "Past of 'cut'?",
      "targetStructure": "irregular-verbs",
      "options": [
        "cutted",
        "cut",
        "cutten"
      ],
      "correctOptionIndex": 1,
      "explanation": "Cut doesn't change at all in the past simple."
    },
    {
      "question": "Past of 'speak'?",
      "targetStructure": "irregular-verbs",
      "options": [
        "speaked",
        "spoke",
        "spoken"
      ],
      "correctOptionIndex": 1,
      "explanation": "Speak → spoke (vowel-change group)."
    }
  ],
  "freerPractice": {
    "title": "Freer Practice: Irregular Verbs",
    "content": "Guided communicative exchanges applying Irregular Verbs in everyday conversation.",
    "links": [
      "COSYgames/scene_match"
    ]
  },
  "production": {
    "title": "Communicative Production: Irregular Verbs",
    "content": "Independent oral production and real-world task execution using Irregular Verbs.",
    "links": [
      "COSYevents/speaking-club"
    ]
  }
}