{
  "unitId": "EN-A1-ENGLISH-AROUND-WORLD-01",
  "title": "English Around the World",
  "level": "A1",
  "language": "en",
  "leadIn": {
    "title": "Lead-In & Context: English Around the World",
    "content": "Contextual introduction and guided observation for English Around the World."
  },
  "meaningCheck": [
    {
      "question": "Function check: What is the primary purpose of using English Around the World?",
      "targetStructure": "english-around-world",
      "options": [
        "To express clear, level-appropriate meaning in structured context",
        "To translate sentences word-for-word from another language",
        "It is an obsolete form never used by native speakers"
      ],
      "correctOptionIndex": 0,
      "explanation": "Correct · This structure provides explicit grammatical function and clarity."
    },
    {
      "question": "Form check: Does correct usage of English Around the World require matching subject, verb, and modifier agreements?",
      "targetStructure": "english-around-world",
      "options": [
        "No, agreement rules are optional in English",
        "Yes, matching grammatical forms ensures natural, accurate communication",
        "Agreement only matters in formal academic writing"
      ],
      "correctOptionIndex": 1,
      "explanation": "Correct · Accurate form and agreement choices prevent misunderstandings."
    }
  ],
  "form": {
    "title": "Form & Structure: English Around the World",
    "content": "Grammatical formulation, usage rules, and structural tables for English Around the World."
  },
  "pronunciation": {
    "title": "Pronunciation Notes: English Around the World",
    "content": "Spoken stress, weak forms, intonation, and articulation patterns for English Around the World."
  },
  "controlledPractice": [
    {
      "question": "'I've got a car' most naturally reflects:",
      "targetStructure": "english-around-world",
      "options": [
        "US-only usage",
        "UK usage (also fine in US/CA)",
        "a mistake"
      ],
      "correctOptionIndex": 1,
      "explanation": "Have got for possession is the everyday UK form, and is also understood/used in US and Canada."
    },
    {
      "question": "US word for 'flat'?",
      "targetStructure": "english-around-world",
      "options": [
        "apartment",
        "holiday",
        "biscuit"
      ],
      "correctOptionIndex": 0,
      "explanation": "Flat (UK) = apartment (US)."
    },
    {
      "question": "UK date order for numbers?",
      "targetStructure": "english-around-world",
      "options": [
        "month/day/year",
        "day/month/year",
        "year/month/day"
      ],
      "correctOptionIndex": 1,
      "explanation": "UK and Australia write dates as day/month/year."
    }
  ],
  "freerPractice": {
    "title": "Freer Practice: English Around the World",
    "content": "Guided communicative exchanges applying English Around the World in everyday conversation.",
    "links": [
      "COSYgames/scene_match"
    ]
  },
  "production": {
    "title": "Communicative Production: English Around the World",
    "content": "Independent oral production and real-world task execution using English Around the World.",
    "links": [
      "COSYevents/speaking-club"
    ]
  }
}