{
  "unitId": "EN-A1-ARTICLES-01",
  "title": "Articles: A / An / The",
  "level": "A1",
  "language": "en",
  "leadIn": {
    "title": "Lead-In & Context: Articles: A / An / The",
    "content": "Contextual introduction and guided observation for Articles: A / An / The."
  },
  "meaningCheck": [
    {
      "question": "Function check: What is the primary purpose of using Articles: A / An / The?",
      "targetStructure": "articles",
      "options": [
        "To express clear, level-appropriate meaning in structured context",
        "To translate sentences word-for-word from another language",
        "It is an obsolete form never used by native speakers"
      ],
      "correctOptionIndex": 0,
      "explanation": "Correct · This structure provides explicit grammatical function and clarity."
    },
    {
      "question": "Form check: Does correct usage of Articles: A / An / The require matching subject, verb, and modifier agreements?",
      "targetStructure": "articles",
      "options": [
        "No, agreement rules are optional in English",
        "Yes, matching grammatical forms ensures natural, accurate communication",
        "Agreement only matters in formal academic writing"
      ],
      "correctOptionIndex": 1,
      "explanation": "Correct · Accurate form and agreement choices prevent misunderstandings."
    }
  ],
  "form": {
    "title": "Form & Structure: Articles: A / An / The",
    "content": "Grammatical formulation, usage rules, and structural tables for Articles: A / An / The."
  },
  "pronunciation": {
    "title": "Pronunciation Notes: Articles: A / An / The",
    "content": "Spoken stress, weak forms, intonation, and articulation patterns for Articles: A / An / The."
  },
  "controlledPractice": [
    {
      "question": "'She has ___ apple.'",
      "targetStructure": "articles",
      "options": [
        "a",
        "an",
        "the"
      ],
      "correctOptionIndex": 1,
      "explanation": "Apple starts with a vowel sound, so it takes 'an'."
    },
    {
      "question": "'I saw a dog. ___ dog was brown.'",
      "targetStructure": "articles",
      "options": [
        "A",
        "An",
        "The"
      ],
      "correctOptionIndex": 2,
      "explanation": "Once something is already mentioned, use 'the'."
    },
    {
      "question": "'I like ___ music.' (talking about music in general)",
      "targetStructure": "articles",
      "options": [
        "a",
        "the",
        "(no article)"
      ],
      "correctOptionIndex": 2,
      "explanation": "General, uncountable ideas usually take no article at all."
    }
  ],
  "freerPractice": {
    "title": "Freer Practice: Articles: A / An / The",
    "content": "Guided communicative exchanges applying Articles: A / An / The in everyday conversation.",
    "links": [
      "COSYgames/scene_match"
    ]
  },
  "production": {
    "title": "Communicative Production: Articles: A / An / The",
    "content": "Independent oral production and real-world task execution using Articles: A / An / The.",
    "links": [
      "COSYevents/speaking-club"
    ]
  }
}