{
  "unitId": "EN-A1-COMPARATIVE-ADJECTIVES-01",
  "title": "Comparative Adjectives",
  "level": "A1",
  "language": "en",
  "leadIn": {
    "title": "Lead-In & Context: Comparative Adjectives",
    "content": "Contextual introduction and guided observation for Comparative Adjectives."
  },
  "meaningCheck": [
    {
      "question": "Function check: What is the primary purpose of using Comparative Adjectives?",
      "targetStructure": "comparative-adjectives",
      "options": [
        "To express clear, level-appropriate meaning in structured context",
        "To translate sentences word-for-word from another language",
        "It is an obsolete form never used by native speakers"
      ],
      "correctOptionIndex": 0,
      "explanation": "Correct · This structure provides explicit grammatical function and clarity."
    },
    {
      "question": "Form check: Does correct usage of Comparative Adjectives require matching subject, verb, and modifier agreements?",
      "targetStructure": "comparative-adjectives",
      "options": [
        "No, agreement rules are optional in English",
        "Yes, matching grammatical forms ensures natural, accurate communication",
        "Agreement only matters in formal academic writing"
      ],
      "correctOptionIndex": 1,
      "explanation": "Correct · Accurate form and agreement choices prevent misunderstandings."
    }
  ],
  "form": {
    "title": "Form & Structure: Comparative Adjectives",
    "content": "Grammatical formulation, usage rules, and structural tables for Comparative Adjectives."
  },
  "pronunciation": {
    "title": "Pronunciation Notes: Comparative Adjectives",
    "content": "Spoken stress, weak forms, intonation, and articulation patterns for Comparative Adjectives."
  },
  "controlledPractice": [
    {
      "question": "Comparative of 'big'?",
      "targetStructure": "comparative-adjectives",
      "options": [
        "biger",
        "bigger",
        "more big"
      ],
      "correctOptionIndex": 1,
      "explanation": "Consonant+vowel+consonant → double the final letter: big → bigger."
    },
    {
      "question": "Comparative of 'expensive'?",
      "targetStructure": "comparative-adjectives",
      "options": [
        "expensiver",
        "more expensive",
        "expensiest"
      ],
      "correctOptionIndex": 1,
      "explanation": "Long adjectives (2+ syllables) use 'more' instead of changing the word."
    },
    {
      "question": "Comparative of 'good'?",
      "targetStructure": "comparative-adjectives",
      "options": [
        "gooder",
        "more good",
        "better"
      ],
      "correctOptionIndex": 2,
      "explanation": "Good → better is an irregular special form."
    }
  ],
  "freerPractice": {
    "title": "Freer Practice: Comparative Adjectives",
    "content": "Guided communicative exchanges applying Comparative Adjectives in everyday conversation.",
    "links": [
      "COSYgames/scene_match"
    ]
  },
  "production": {
    "title": "Communicative Production: Comparative Adjectives",
    "content": "Independent oral production and real-world task execution using Comparative Adjectives.",
    "links": [
      "COSYevents/speaking-club"
    ]
  }
}