{
  "unitId": "EN-A1-PART-6-ADVERBS-01",
  "title": "Adverbs",
  "level": "A1",
  "language": "en",
  "leadIn": {
    "title": "Lead-In & Context: Adverbs",
    "content": "Contextual introduction and guided observation for Adverbs."
  },
  "meaningCheck": [
    {
      "question": "Function check: What is the primary purpose of using Adverbs?",
      "targetStructure": "part-6-adverbs",
      "options": [
        "To express clear, level-appropriate meaning in structured context",
        "To translate sentences word-for-word from another language",
        "It is an obsolete form never used by native speakers"
      ],
      "correctOptionIndex": 0,
      "explanation": "Correct · This structure provides explicit grammatical function and clarity."
    },
    {
      "question": "Form check: Does correct usage of Adverbs require matching subject, verb, and modifier agreements?",
      "targetStructure": "part-6-adverbs",
      "options": [
        "No, agreement rules are optional in English",
        "Yes, matching grammatical forms ensures natural, accurate communication",
        "Agreement only matters in formal academic writing"
      ],
      "correctOptionIndex": 1,
      "explanation": "Correct · Accurate form and agreement choices prevent misunderstandings."
    }
  ],
  "form": {
    "title": "Form & Structure: Adverbs",
    "content": "Grammatical formulation, usage rules, and structural tables for Adverbs."
  },
  "pronunciation": {
    "title": "Pronunciation Notes: Adverbs",
    "content": "Spoken stress, weak forms, intonation, and articulation patterns for Adverbs."
  },
  "controlledPractice": [],
  "freerPractice": {
    "title": "Freer Practice: Adverbs",
    "content": "Guided communicative exchanges applying Adverbs in everyday conversation.",
    "links": [
      "COSYgames/scene_match"
    ]
  },
  "production": {
    "title": "Communicative Production: Adverbs",
    "content": "Independent oral production and real-world task execution using Adverbs.",
    "links": [
      "COSYevents/speaking-club"
    ]
  }
}