{
  "unitId": "EN-A1-TO-BE-01",
  "title": "The Verb 'To Be'",
  "level": "A1",
  "language": "en",
  "leadIn": {
    "title": "Lead-In & Context: The Verb 'To Be'",
    "content": "Contextual introduction and guided observation for The Verb 'To Be'."
  },
  "meaningCheck": [
    {
      "question": "\"Julia is a teacher.\" — Is Julia a teacher now?",
      "targetStructure": "to-be",
      "options": [
        "Yes",
        "No, only in the past",
        "We can't tell"
      ],
      "correctOptionIndex": 0,
      "explanation": "Yes · 'Is' describes a current state or job in the present simple."
    },
    {
      "question": "\"John is a doctor.\" — Is John a teacher?",
      "targetStructure": "to-be",
      "options": [
        "Yes",
        "No, he is a doctor",
        "Yes, he teaches at school"
      ],
      "correctOptionIndex": 1,
      "explanation": "No, he is a doctor · The sentence explicitly states his profession is a doctor."
    },
    {
      "question": "Sentence check: Can you say \"Julia are a teacher\"?",
      "targetStructure": "to-be",
      "options": [
        "Yes",
        "No",
        "Yes, in informal speech"
      ],
      "correctOptionIndex": 1,
      "explanation": "No · Singular subject 'Julia' (she) requires 'is', not 'are'."
    }
  ],
  "form": {
    "title": "Form & Structure: The Verb 'To Be'",
    "content": "Grammatical formulation, usage rules, and structural tables for The Verb 'To Be'."
  },
  "pronunciation": {
    "title": "Pronunciation Notes: The Verb 'To Be'",
    "content": "Spoken stress, weak forms, intonation, and articulation patterns for The Verb 'To Be'."
  },
  "controlledPractice": [
    {
      "question": "'They ___ doctors.'",
      "targetStructure": "to-be",
      "options": [
        "is",
        "am",
        "are"
      ],
      "correctOptionIndex": 2,
      "explanation": "They pairs with 'are': They are doctors."
    },
    {
      "question": "Which is the correct negative of 'She is happy'?",
      "targetStructure": "to-be",
      "options": [
        "She not is happy.",
        "She isn't happy.",
        "She don't happy."
      ],
      "correctOptionIndex": 1,
      "explanation": "To be forms its own negative: is + not → isn't."
    },
    {
      "question": "'___ it Monday today?'",
      "targetStructure": "to-be",
      "options": [
        "Is",
        "Are",
        "Do"
      ],
      "correctOptionIndex": 0,
      "explanation": "'It' takes 'is', and questions with to be invert subject and verb: Is it…?"
    }
  ],
  "freerPractice": {
    "title": "Freer Practice: The Verb 'To Be'",
    "content": "Guided communicative exchanges applying The Verb 'To Be' in everyday conversation.",
    "links": [
      "COSYgames/scene_match"
    ]
  },
  "production": {
    "title": "Communicative Production: The Verb 'To Be'",
    "content": "Independent oral production and real-world task execution using The Verb 'To Be'.",
    "links": [
      "COSYevents/speaking-club"
    ]
  }
}