{
  "unitId": "EN-A1-PREPOSITIONS-TIME-01",
  "title": "Prepositions of Time",
  "level": "A1",
  "language": "en",
  "leadIn": {
    "title": "Lead-In & Context: Prepositions of Time",
    "content": "Contextual introduction and guided observation for Prepositions of Time."
  },
  "meaningCheck": [
    {
      "question": "Function check: What is the primary purpose of using Prepositions of Time?",
      "targetStructure": "prepositions-time",
      "options": [
        "To express clear, level-appropriate meaning in structured context",
        "To translate sentences word-for-word from another language",
        "It is an obsolete form never used by native speakers"
      ],
      "correctOptionIndex": 0,
      "explanation": "Correct · This structure provides explicit grammatical function and clarity."
    },
    {
      "question": "Form check: Does correct usage of Prepositions of Time require matching subject, verb, and modifier agreements?",
      "targetStructure": "prepositions-time",
      "options": [
        "No, agreement rules are optional in English",
        "Yes, matching grammatical forms ensures natural, accurate communication",
        "Agreement only matters in formal academic writing"
      ],
      "correctOptionIndex": 1,
      "explanation": "Correct · Accurate form and agreement choices prevent misunderstandings."
    }
  ],
  "form": {
    "title": "Form & Structure: Prepositions of Time",
    "content": "Grammatical formulation, usage rules, and structural tables for Prepositions of Time."
  },
  "pronunciation": {
    "title": "Pronunciation Notes: Prepositions of Time",
    "content": "Spoken stress, weak forms, intonation, and articulation patterns for Prepositions of Time."
  },
  "controlledPractice": [
    {
      "question": "'I was born ___ 2001.'",
      "targetStructure": "prepositions-time",
      "options": [
        "in",
        "on",
        "at"
      ],
      "correctOptionIndex": 0,
      "explanation": "Years take 'in'."
    },
    {
      "question": "'See you ___ Monday.'",
      "targetStructure": "prepositions-time",
      "options": [
        "in",
        "on",
        "at"
      ],
      "correctOptionIndex": 1,
      "explanation": "Days take 'on'."
    },
    {
      "question": "'The film starts ___ 8 o'clock.'",
      "targetStructure": "prepositions-time",
      "options": [
        "in",
        "on",
        "at"
      ],
      "correctOptionIndex": 2,
      "explanation": "Clock times take 'at'."
    }
  ],
  "freerPractice": {
    "title": "Freer Practice: Prepositions of Time",
    "content": "Guided communicative exchanges applying Prepositions of Time in everyday conversation.",
    "links": [
      "COSYgames/scene_match"
    ]
  },
  "production": {
    "title": "Communicative Production: Prepositions of Time",
    "content": "Independent oral production and real-world task execution using Prepositions of Time.",
    "links": [
      "COSYevents/speaking-club"
    ]
  }
}