{
  "unitId": "EN-A1-ALL-BOTH-NONE-01",
  "title": "All, Both, Either, Neither, None",
  "level": "A1",
  "language": "en",
  "leadIn": {
    "title": "Lead-In & Context: All, Both, Either, Neither, None",
    "content": "Contextual introduction and guided observation for All, Both, Either, Neither, None."
  },
  "meaningCheck": [
    {
      "question": "Function check: What is the primary purpose of using All, Both, Either, Neither, None?",
      "targetStructure": "all-both-none",
      "options": [
        "To express clear, level-appropriate meaning in structured context",
        "To translate sentences word-for-word from another language",
        "It is an obsolete form never used by native speakers"
      ],
      "correctOptionIndex": 0,
      "explanation": "Correct · This structure provides explicit grammatical function and clarity."
    },
    {
      "question": "Form check: Does correct usage of All, Both, Either, Neither, None require matching subject, verb, and modifier agreements?",
      "targetStructure": "all-both-none",
      "options": [
        "No, agreement rules are optional in English",
        "Yes, matching grammatical forms ensures natural, accurate communication",
        "Agreement only matters in formal academic writing"
      ],
      "correctOptionIndex": 1,
      "explanation": "Correct · Accurate form and agreement choices prevent misunderstandings."
    }
  ],
  "form": {
    "title": "Form & Structure: All, Both, Either, Neither, None",
    "content": "Grammatical formulation, usage rules, and structural tables for All, Both, Either, Neither, None."
  },
  "pronunciation": {
    "title": "Pronunciation Notes: All, Both, Either, Neither, None",
    "content": "Spoken stress, weak forms, intonation, and articulation patterns for All, Both, Either, Neither, None."
  },
  "controlledPractice": [
    {
      "question": "Two books, both mine: '___ books are mine.'",
      "targetStructure": "all-both-none",
      "options": [
        "All",
        "Both",
        "None"
      ],
      "correctOptionIndex": 1,
      "explanation": "Both is used for exactly two things."
    },
    {
      "question": "Neither takes a ___ verb.",
      "targetStructure": "all-both-none",
      "options": [
        "plural",
        "singular",
        "past"
      ],
      "correctOptionIndex": 1,
      "explanation": "Either and neither are followed by a singular verb, even though they refer to two things."
    },
    {
      "question": "A whole group with zero exceptions found: '___ of my friends were late.'",
      "targetStructure": "all-both-none",
      "options": [
        "None",
        "Neither",
        "Either"
      ],
      "correctOptionIndex": 0,
      "explanation": "None is used for groups of three or more, meaning zero."
    }
  ],
  "freerPractice": {
    "title": "Freer Practice: All, Both, Either, Neither, None",
    "content": "Guided communicative exchanges applying All, Both, Either, Neither, None in everyday conversation.",
    "links": [
      "COSYgames/scene_match"
    ]
  },
  "production": {
    "title": "Communicative Production: All, Both, Either, Neither, None",
    "content": "Independent oral production and real-world task execution using All, Both, Either, Neither, None.",
    "links": [
      "COSYevents/speaking-club"
    ]
  }
}