{
  "unitId": "EN-A1-ADVERBS-FREQUENCY-01",
  "title": "Adverbs of Frequency",
  "level": "A1",
  "language": "en",
  "leadIn": {
    "title": "Lead-In & Context: Adverbs of Frequency",
    "content": "Contextual introduction and guided observation for Adverbs of Frequency."
  },
  "meaningCheck": [
    {
      "question": "Function check: What is the primary purpose of using Adverbs of Frequency?",
      "targetStructure": "adverbs-frequency",
      "options": [
        "To express clear, level-appropriate meaning in structured context",
        "To translate sentences word-for-word from another language",
        "It is an obsolete form never used by native speakers"
      ],
      "correctOptionIndex": 0,
      "explanation": "Correct · This structure provides explicit grammatical function and clarity."
    },
    {
      "question": "Form check: Does correct usage of Adverbs of Frequency require matching subject, verb, and modifier agreements?",
      "targetStructure": "adverbs-frequency",
      "options": [
        "No, agreement rules are optional in English",
        "Yes, matching grammatical forms ensures natural, accurate communication",
        "Agreement only matters in formal academic writing"
      ],
      "correctOptionIndex": 1,
      "explanation": "Correct · Accurate form and agreement choices prevent misunderstandings."
    }
  ],
  "form": {
    "title": "Form & Structure: Adverbs of Frequency",
    "content": "Grammatical formulation, usage rules, and structural tables for Adverbs of Frequency."
  },
  "pronunciation": {
    "title": "Pronunciation Notes: Adverbs of Frequency",
    "content": "Spoken stress, weak forms, intonation, and articulation patterns for Adverbs of Frequency."
  },
  "controlledPractice": [
    {
      "question": "'I ___ go to the cinema.' (70% of the time)",
      "targetStructure": "adverbs-frequency",
      "options": [
        "go often",
        "often go",
        "going often"
      ],
      "correctOptionIndex": 1,
      "explanation": "Frequency adverbs usually go before the main verb: often go."
    },
    {
      "question": "'She ___ late.' (100% of the time)",
      "targetStructure": "adverbs-frequency",
      "options": [
        "always is",
        "is always",
        "is late always"
      ],
      "correctOptionIndex": 1,
      "explanation": "With 'to be', the frequency adverb goes after the verb: is always."
    },
    {
      "question": "Which is the least frequent?",
      "targetStructure": "adverbs-frequency",
      "options": [
        "usually",
        "rarely",
        "often"
      ],
      "correctOptionIndex": 1,
      "explanation": "Rarely sits near the 'never' end of the scale, around 10%."
    }
  ],
  "freerPractice": {
    "title": "Freer Practice: Adverbs of Frequency",
    "content": "Guided communicative exchanges applying Adverbs of Frequency in everyday conversation.",
    "links": [
      "COSYgames/scene_match"
    ]
  },
  "production": {
    "title": "Communicative Production: Adverbs of Frequency",
    "content": "Independent oral production and real-world task execution using Adverbs of Frequency.",
    "links": [
      "COSYevents/speaking-club"
    ]
  }
}