{
  "unitId": "EN-A1-PREPOSITIONS-PLACE-01",
  "title": "Prepositions of Place",
  "level": "A1",
  "language": "en",
  "leadIn": {
    "title": "Lead-In & Context: Prepositions of Place",
    "content": "Contextual introduction and guided observation for Prepositions of Place."
  },
  "meaningCheck": [
    {
      "question": "Function check: What is the primary purpose of using Prepositions of Place?",
      "targetStructure": "prepositions-place",
      "options": [
        "To express clear, level-appropriate meaning in structured context",
        "To translate sentences word-for-word from another language",
        "It is an obsolete form never used by native speakers"
      ],
      "correctOptionIndex": 0,
      "explanation": "Correct · This structure provides explicit grammatical function and clarity."
    },
    {
      "question": "Form check: Does correct usage of Prepositions of Place require matching subject, verb, and modifier agreements?",
      "targetStructure": "prepositions-place",
      "options": [
        "No, agreement rules are optional in English",
        "Yes, matching grammatical forms ensures natural, accurate communication",
        "Agreement only matters in formal academic writing"
      ],
      "correctOptionIndex": 1,
      "explanation": "Correct · Accurate form and agreement choices prevent misunderstandings."
    }
  ],
  "form": {
    "title": "Form & Structure: Prepositions of Place",
    "content": "Grammatical formulation, usage rules, and structural tables for Prepositions of Place."
  },
  "pronunciation": {
    "title": "Pronunciation Notes: Prepositions of Place",
    "content": "Spoken stress, weak forms, intonation, and articulation patterns for Prepositions of Place."
  },
  "controlledPractice": [
    {
      "question": "The cat is sitting on top of the basket. Which preposition?",
      "targetStructure": "prepositions-place",
      "options": [
        "in",
        "on",
        "under"
      ],
      "correctOptionIndex": 1,
      "explanation": "On means on top of a surface."
    },
    {
      "question": "Fix: 'The book is in the shelf.'",
      "targetStructure": "prepositions-place",
      "options": [
        "The book is on the shelf.",
        "The book is at the shelf.",
        "The book is over the shelf."
      ],
      "correctOptionIndex": 0,
      "explanation": "Books sit 'on' a shelf's surface, not 'in' it."
    },
    {
      "question": "Two baskets, the cat is in the middle: 'The cat is ___ the baskets.'",
      "targetStructure": "prepositions-place",
      "options": [
        "between",
        "next to",
        "behind"
      ],
      "correctOptionIndex": 0,
      "explanation": "Between describes a position in the middle of two things."
    }
  ],
  "freerPractice": {
    "title": "Freer Practice: Prepositions of Place",
    "content": "Guided communicative exchanges applying Prepositions of Place in everyday conversation.",
    "links": [
      "COSYgames/scene_match"
    ]
  },
  "production": {
    "title": "Communicative Production: Prepositions of Place",
    "content": "Independent oral production and real-world task execution using Prepositions of Place.",
    "links": [
      "COSYevents/speaking-club"
    ]
  }
}