{
  "unitId": "EN-A1-PART-2-NOUNS-POSSESSION-01",
  "title": "Nouns & Possession",
  "level": "A1",
  "language": "en",
  "leadIn": {
    "title": "Lead-In & Context: Nouns & Possession",
    "content": "Contextual introduction and guided observation for Nouns & Possession."
  },
  "meaningCheck": [
    {
      "question": "Function check: What is the primary purpose of using Nouns & Possession?",
      "targetStructure": "part-2-nouns-possession",
      "options": [
        "To express clear, level-appropriate meaning in structured context",
        "To translate sentences word-for-word from another language",
        "It is an obsolete form never used by native speakers"
      ],
      "correctOptionIndex": 0,
      "explanation": "Correct · This structure provides explicit grammatical function and clarity."
    },
    {
      "question": "Form check: Does correct usage of Nouns & Possession require matching subject, verb, and modifier agreements?",
      "targetStructure": "part-2-nouns-possession",
      "options": [
        "No, agreement rules are optional in English",
        "Yes, matching grammatical forms ensures natural, accurate communication",
        "Agreement only matters in formal academic writing"
      ],
      "correctOptionIndex": 1,
      "explanation": "Correct · Accurate form and agreement choices prevent misunderstandings."
    }
  ],
  "form": {
    "title": "Form & Structure: Nouns & Possession",
    "content": "Grammatical formulation, usage rules, and structural tables for Nouns & Possession."
  },
  "pronunciation": {
    "title": "Pronunciation Notes: Nouns & Possession",
    "content": "Spoken stress, weak forms, intonation, and articulation patterns for Nouns & Possession."
  },
  "controlledPractice": [],
  "freerPractice": {
    "title": "Freer Practice: Nouns & Possession",
    "content": "Guided communicative exchanges applying Nouns & Possession in everyday conversation.",
    "links": [
      "COSYgames/scene_match"
    ]
  },
  "production": {
    "title": "Communicative Production: Nouns & Possession",
    "content": "Independent oral production and real-world task execution using Nouns & Possession.",
    "links": [
      "COSYevents/speaking-club"
    ]
  }
}